title,description,real_salary
Программист 1С,"Высшее специализированное образование. Опыт работы в данной сфере. Стрессоустойчивость, коммуникабельность, исполнительность. Программирование и конфигурирование на базе платформы 1С 8.3. Поддержка, доработка разработанных подсистем.",78300.0
Инженер-программист,Знание принципов работы RTOS и опыт их использования в проектах на микроконтроллерах. - Опыт разработки электронных устройств на микропроцессорах ARM. -  Участие в разработке микропроцессорных устройств и контроллеров для мультимедиа периферии и IoT. - Разработка и написание ПО на языке С/С++...,150000.0
"Монтажер программы ""Beautytime""","Наличие опыта работы в программе Adobe Premiere. Опыт работы видеографом, монтажером, режиссером. Монтаж программы на канале, удаленная работа невозможна. Работа в соц.сетях. Работа по созданию дизайна программы, элементов, эффектов.",27500.0
Программист C#,Высшее техническое образование. Опыт работы: от 3-х лет в коммерческой разработке с использованием C#. Владение технологиями и инструментами: WPF... Рефакторинг и оптимизация. Разработка новых продуктов компании. Выполнение peer code review. Создание и исправление технической документации. Консультации внешних разработчиков.,225000.0
Продюсер образовательных программ,"Уверенный пользователь ПК. Умение работать с текстом. Умение находить нестандартные решения. Коммуникабельность. Готовность погружаться в тематику создаваемых образовательных проектов.  Создавать, загружать и администрировать контент для BoxBattle: Вопросы для тестирований и викторин. Наборы геймифицированных заданий, описывать содержимое и создавать текстовые...",30450.0
Инженер-программист (АСУ ТП),"Знание основ реляционных баз данных. Знание основ построения промышленных сетей. Знание основ «робототехники» будет преимуществом. Знание английского языка по специальности... Разработка верхнего и нижнего уровней программного обеспечения. Разработка программной документации в соответствии с ЕСПД. Разработка визуального интерфейса. Сбор, организация хранения...",62640.0
Программист 1С,Опыт работы с 1С (желательно ЗУП). Желание учиться и развиваться в этом направлении. Осуществление перехода с ЗУП 2.5 на ЗУП 3.1. Поддержка текущих конфигураций компании. Работа с запросами. Работа с отчетами. ,65000.0
Программист Python,"Знание Python или иных скриптовых языков с последующей миграцией на Python. Хорошее знание SQL. Умение и желание писать качественный, поддерживаемый... ",145725.0
Инженер-программист,Знание принципов работы RTOS и опыт их использования в проектах на микроконтроллерах. - Опыт разработки электронных устройств на микропроцессорах ARM. -  Участие в разработке микропроцессорных устройств и контроллеров для мультимедиа периферии и IoT. - Разработка и написание ПО на языке С/С++...,150000.0
Программист 1C,"Высшее / неоконченное высшее образование (математическое, техническое, информационные технологии, программная инженерия, прикладная математика и тд). Опыт программирования от 1 года.  Программирование, разработка в среде 1С:Предприятие (8.2, 8.3)?. Доработка конфигураций, форм, отчетов. Разработка нового функционала согласно техническому...",150000.0
Программист/консультант 1С (стажёр),"Знание как минимум одного языка программирования. Опыт работы с базами данных приветствуется. Умение работать в команде, ответственность, быстрая обучаемость, желание... Участие в проектах автоматизации предприятий на базе платформы 1С 8. Доработка прикладных решений на базе платформы 1С 8...",32500.0
Программист 1С,"Опыт работы программистом/разработчиком 1С от 1-го года. - Вы умеете писать код в соответствие со стандартами (без фанатизма). -  Наша основная специализация: оптово-розничная продажа товаров повседневного спроса(упаковка, бытовая химия, канцтовары, хозтовары). - система учета заявок и проектов. - ",120000.0
Программист,"обязательное знание языков программирования (С, C++, Ассемблер, Visual Basic (Visual Studio). - опыт работы с 32 разрядными микроконтроллерами (NXP, SТM и... проектирование и разработка программного обеспечения (ПО) в соответствии с требованиями ГОСТов и другой нормативно-технической документации. - внедрение ПО и организация...",130500.0
Программист (в офис),"Знание основ HTML, PHP, Node.js, Vue.js, Bootstrap, Vuetify. ",45000.0
программист 1с,  ,200000.0
Ведущий инженер-программист (тестировщик),"Высшее профессионально образование (программирование). Опыт работы конструктором-программистом С С++. Знания методологий и методик тестирования, знание стандартов в области тестирования.  Тестирование разрабатываемых программно-аппаратных комплексов в составе систем электропривода. Анализ документации. Выполнение тестовых процедур.",56528.25
Web-программист (офис),"Ищем в команду ответственного, отзывчивого и внимательного к деталям человека, который имеет требуемый опыт работы, хочет достигать свои финансовые цели... Разработка и администрирование сайтов, в частности Frontend и базовый Backend. Интеграция сайтов с внешними и внутренними системами.Установка на CMS: 1...",130000.0
Программист .NET,"Высшее образование. Опыт разработки приложений на ASP.NET MVC, HTML, CSS, JavaScript, jQuery, Entity Framework, базы данных MS SQL Server.  Full-stack разработка и поддержка ASP.NET MVC приложений, веб-сервисов и других продуктов. Использование GitLab в качестве системы контроля версий...",69600.0
Инженер-программист (Web-разработчик),"Профессиональное владение БИТРИКС: УПРАВЛЕНИЕ САЙТОМ. Практические знания PHP7.1+: (namespaces, traits, etc), стандартов PSR, SOLID принципов, умение пользоваться... Создание нового сайта и редактирование основного сайта компании, верстка и программное наполнение. (Динамические страницы, выборки из базы данных по критериям...",32500.0
"Программист 1C 8.2, 8.3","Опыт разработки (программирования) на платформе 1С 8.2, 8.3 от 2-х лет. Приветствуется наличие сертификата 1С... Доработка конфигурации 1С 8.2 Астор «Торговая сеть». Формализация и систематизация требований заказчика к информационной системе. Тестирование.",134850.0
аналитик-программист,"   Задачи: - Проведение обследований и функционального моделирования; - Согласование с заказчиком требований к ПО и выбор оптимальных решений; - Настройка типового функционала, написание инструкций; - Постановка задач внешним исполнителям; - Формирование Технических заданий разработчикам; - Организация тестирования ПО и приемка работ; - Контроль качества работы исполнителей; - Ведение задач в CRM компании: постановка и контроль задач; - Разработка планов внедрения и соблюдение сроков. Требования: - Высшее образование (экономическое, техническое); - Опыт работы с 1С от 3-хлет; - Знание двух и более из конфигураций: 1С:ERP, 1С:КА, 1С:БП, 1С:ЗУП, 1C:БИТ.Строительство (Финанс), 1С:КД; - Знание управленческого, бухгалтерского и финансового учета; - Понимание языка программирования 1С и СКД; - Умение читать чужой код и пользоваться отладчиком; - Опыт работы в качестве руководителя проекта, аналитика в проектах перехода, миграции, внедрения ПО 1С: Предприятие; - Умение анализировать и структурировать информацию; - Хорошие коммуникативные навыки, грамотная речь. Будет плюсом: - Опыт разработки и оптимизации кода 1С; - Успешный опыт работы руководителем проектов по внедрению и миграции ПО, подтверждённый рекомендациями работодателя или заказчика; - Опыт реализации проектов в сфере строительства; - Наличие сертификатов 1С. ",100000.0
Тренер тренажерного зала и групповых программ в Сочи,"Имеешь профильное образование, а также сертификаты о прохождении специализированных курсов. Отлично понимаешь анатомию, физиологию и теорию физической культуры.  Проведение персональных и групповых тренировок (с учетом вашей специализации). Дежурство в тренажерном зале. Составление индивидуальных программ тренировок с учетом особенностей...",80000.0
Программный редактор радиостанций,"Опыт работы в смежной сфере от 1 года (радио, ТВ, СМИ). Опыт ведения аккаунтов ВК. Креативность, грамотная речь, отличное владение... Соблюдение форматов и редакционной политики радиостанций, которые находятся в вашей компетенции. Коммуникация с региональными службами федеральных радиостанций. Согласование всех эфирных...",25000.0
Программист," Основные направления работы: 1. Верстка прокл по ТЗ. 2. Подключение офферов (настройка Апи, скриптов, постбека и т.п.). 3. ",35000.0
Программист-стажер," использование выбранной среды программирования для разработки процедур интеграции программных модулей. - разработка/доработка процедур, обеспечивающие возможность выполнения проверки ошибок данных перед...",26100.0
Бекенд-программист / Backend-developer/ Golang (удаленно),"SQL join запросы, индексы. Утилиты консольной строки: cat, sed, awk, cut, top …. Docker (умение написать докер-файл, запустить контейнер и... Разрабатывать бэкэнд (для веб-приложения и iOS/ Android - приложения) проекта ""SoftSkills"".",130000.0
Программист,"Знание конфигурации 1С ERP. Коммуникабельность, желание и способность общаться с людьми. Программирование в 1С. Консультирование пользователей по работе в 1С ERP, оперативное решение вопросов и проблем.",30000.0
Программист 1С - Middle Expert / Senior,"Опыт программирования в 1С. Умение писать нетривиальные запросы, которые работают быстро. Опыт разработки обменов данными в различных форматах.  Программировать на платформе 1С: 8.3 (Обычные и управляемые формы). Дорабатывать конфигураций по корректно сформулированным техническим заданиям. ",185000.0
Ведущий программист 1С," Участие в автоматизации бизнес-процессов компании на базе 1С УПП (Подсистемы продажи, производство, закупки, логистика /БДДС/БДР/консолидация и...",150000.0
наладчик станков и манипуляторов с программным управлением,"Компас-3D Точность и внимательность к деталям Автоматизированное рабочее место (АРМ) Уверенный пользователь ПК Compass 3D  Наладка на холостом ходу и в рабочем режиме механических и электромеханических устройств станка с программным управлением для обработки сложных деталей. выполнение расчетов, связанных с наладкой, управлением и пуском станков с программным управлением. Наладка нулевого положения и зажимных приспособлений. Установление технологической последовательности обработки. Подбор режущего, контрольно-измерительного инструмента и приспособлений по технологической карте. Установка и смена приспособлений и инструмента в системе координат. Отладка, изготовление деталей и сдача их в ОТК. Корректировка режимов резания по результатам станка. Проверка станков на точность. Среднее специальное или высшее образование; Опыт работы на металлообрабатывающем оборудовании (токарная группа) от 1 года; Навыки в разработке управляющих программ со стойки управления оборудования; Знание современных методов в обработке материалов на станках с ЧПУ, современного режущего инструмента и оснастки; Умение читать конструкторскую и техническую документацию. График работы пн-пт с 8:00 до 17:00; Официальное оформление по ТК РФ; Официальная заработная плата, выплаты 2 раза в месяц; Оплачиваемый больничный, отпуск; Медицинское обслуживание; Спец. одежда, необходимые инструменты; Ежегодная индексация заработной платы. ",39400.0
"Программист Битрикс (PHP, Bitrix, веб разработчик)","Высокий уровень ответственности, 8 часовой рабочий день / 40ч. рабочая неделя. Опыт веб разработки с Битрикс / Bitrix API от 3... Реализация новых, интересных сервисов и функций, направленных на развитие сайта и платформы. Командная разработка основного сайта ИМ на PHP / Bitrix. ",150000.0
Начинающий программист,"Навыки делового общения, грамотная устная и письменная речь. Способность работать в режиме многозадачности. Умение работать в команде. Высшее образование. Обработка запросов пользователей на изменения и устранение инцидентов в работе; информационных систем на базе 1С. Доработка конфигурации, дополнительных внешних...",60000.0
Программист 1С,"Опыт программирования 1С 8.2 и 8.3. Знание конфигураций Альфа-Авто, БП, ЗУП (приветствуется). Опыт работы с управляемыми... Доработка и сопровождение нетиповых конфигураций 1С (Альфа-Авто, БП, ЗУП, ДО). Обновление типовых и нетиповых конфигураций. Создание обработок и...",105000.0
Программист 1С,"Знание и практический опыт работы в 1С: Предприятие (версии 8.2, 8.3). Умение оптимизировать производительность системы 1С.  Разработка (кодинг) системы в соответствии с архитектурой решения и планом работ. Доработка существующих модулей, отчетов, интерфейсов. Поддержка уже существующей в...",152250.0
Инженер-программист АСУ ТП,"Знание принципов построения АСУ ТП, архитектуры систем автоматизации и диспетчеризации. Понимание принципов работы приборов КИПиА. Желательно: Python, C++, Codesys. Участие в приемо-сдаточных испытаниях разработанного решения совместно с полевыми инженерами. Подготовка документации по разделам ИО/МО/ПО совместно с...",100000.0
Web-программист,"Стек технологий - php, js, mysql, css, html. CMS сайтов различные, но все популярные и известные (Bitrix, WordPress, Modx, Open Cart... Нужен специалист, который будет готов выполнять поручения маркетолога / руководителя по доработке / улучшению / оптимизации сайтов. - техническая и SEO оптимизация сайтов по...",35000.0
Танцовщица/Танцовщик эксклюзивной шоу-программы,Отсутствие опыта работы в этой сфере или умения танцевать не является препятствием - проводится бесплатное обучение. Работа с хореографами. Стилистика костюмов для танцевальных номеров разрабатывается Вами совместно с нашим хореографом с учетом направления и стиля танца.,110000.0
Инженер-программист,"Опыт программирования ПО ПЛК SIEMENS S300, S400 (Step7, TIA portal). Опыт программирования InTouch, WinCC. Наличие высшего технического... ...случае возникновения запросов от производства. Это основная часть работы (примерно 70% времени). Поиск неисправностей оборудования путем изучения логики работы программы.",60030.0
Web-программист,"Уверенные знания технологий разработки Web-приложений. Уверенные знания PHP, JavaScript. Уверенные знания в области баз данных и SQL (MySQL).  Разработка технического задания. Разработка технологий решения поставленных задач. Разработка проекта решения. Поддержка, доработка и развитие внутренних программных продуктов и web...",57500.0
Программист,"Высшее профессиональное (техническое) образование и стаж работы не менее 3-х лет. Настройка программного обеспечения, оргтехники,техническая поддержка пользователей. -Серверное физическое оборудование (контроль и управление компонентами серверного оборудования). -Сетевое оборудование, маршрутизация и...",26100.0
