title,description,real_salary
Инженер-программист,Опыт разработки и отладки ПО на С/С++ под Linux или FreeRTOS. - Уверенное знание С/С++ и многопоточного программирования. -  Разработка и отладка встраиваемого ПО для микроконтроллеров ARM. - Разработка технической документации. - Техническая поддержка разрабатываемых устройств.,60900.0
Ведущий программист 1С,Опыт работы программистом 1С не менее 3-х лет. Опыт управления командой. Высшее образование (желательно в сфере IT).  Формирование технических заданий для команды 1С и распределение задач между программистами. Разработка нового функционала и доработок по техническим заданиям...,250000.0
Инженер-программист,Опыт работы от 5-ти лет. Инженер-программист по программированию интерфейсного ПО.,78300.0
Web-программист,"Уверенное знание PHP, CSS, JS (jQuery), MySQL. Знание Laravel, знакомство с OctoberCMS. Приветствуется знание Linux и Git. Разработка/доработка программного кода сайтов.",50000.0
Ведущий 1С программист,"Опыт больше 3х лет разработки. Реализации проектов для текущей информационной системы, построенной на базе 1С: Предприятия. - Оптимальные запросы и код. - Сопровождение от проектирования до...",35000.0
TypeScript программист,"Умение разбираться в чужом коде. Опыт разработки на Vue+TypeScript от года. Понимание основ ООП. Опыт работы с системами контроля версий... Расширением и поддержкой фреймворка автотестирования (UI+API) на playwright. Интеграцией в CI (TeamCity, GitLab Ci). Поддержкой и оптимизацией существующих автоматизированных тестов...",325000.0
Программист 1C 8,Опыт программирования на платформе 1С 8.х от 2х лет в режиме управляемого приложения. Базовые знания бизнес-процессов... Участие в проектах разработки на платформе 1С 8.х.,147500.0
Инженер-программист (НИО-63),"Знание языка С, ассемблер. Опыт разработки встроенного ПО. Уверенное владение персональным компьютером в ОС Windows и офисными инструментами.  Разработка и сопровождение встроенного ПО. Оформление программной и конструкторской документации.",50000.0
Менеджер по продажам языковых программ,"Специалист с опытом от 1 года в сфере активных продаж. — Знание языка - Английский - upper-intermediate (B2) и выше - ОБЯЗАТЕЛЬНО. —  Какие задачи предстоит выполнять: — Обрабатывать входящие заявки. — Проводить консультации, продажи продуктов компании. — Проводить телефонные переговоры и встречи с клиентами. — ",80000.0
Программист 1С7.7,"Опыт разработки на платформе 7.7. Опыт использования внешних компонент. Опыт работы с MS SQL и с прямыми запросами к... Доработка конфигураций на платформе 1С 7.7. Обслуживание БД, поддержка пользователей.",120000.0
Программист 1С,Релевантный опыт работы от 1-го года. Навыки обновления типовых и не типовых конфигураций. Будет являться преимуществом знание основ производственного... Разработка нового функционала и поддержка уже созданного в 1С системах. Доработка конфигураций 1С по обращениям пользователей. ,70000.0
Инженер-технолог (программист ЧПУ),"Знание программы AutoCad. Исполнительность, ответственность, внимательность. Опыт работы технологом не менее года. Умение работать в коллективе. Опыт работы в каменной... Современное итальянское оборудование, отлаженный сервис и опытный персонал позволяют производить эксклюзивные изделия из камня и выполнять заказы ""под ключ"", начиная...",72500.0
Ведущий инженер-программист,"...ведущего инженера-программиста не менее 3 лет. - опыт в разработке и создании электронных систем управления в качестве руководителя, либо разработчика... разработка программ, обеспечивающих возможность выполнения алгоритма и соответственно поставленной задачи средствами вычислительной техники, проведение их тестирования и отладки. - ",90000.0
"Специалист по ОЭ и ТОП (операционной эффективности и программе ""Тотальная оптимизация производства"")","Требования: Опыт работы в сфере операционной эффективности, оптимизационной деятельности, опыт участия в проектах по развёртыванию проектов ТОП. Сфера деятельности компаний... Определение приоритетов программы развития ТОП. Управление программой ТОП в части оценки эффекта от идей и его дальнейшего мониторинга. ",120000.0
Программист 1С,"   Развиваться как профессионально, так и по уровню дохода. Рабочая обстановка в компании очень динамичная, если у вас есть желание расти – все дороги открыты; Работать с компаниями разных сфер и разного масштаба; Работать в большой и профессиональной команде. Специалисты компании обладают уникальным и редким опытом, который вы сможете перенимать и учиться у настоящих экспертов; Быть результативным и получать удовольствие от работы; Знание типовых конфигураций 1С: ЗУП, 1С: БП, 1С: ДО; Опыт программирования на языке 1С: Предприятие, ЗУП от двух лет и опыт автоматизации производственных предприятий; Мыслить системно, иметь аналитические способности; Желать разбираться в бизнес-процессах, новых решениях и постоянно повышать свою квалификацию; ",60000.0
Консультант по образовательным программам,"Кругозора, позволяющего разобраться в образовательных продуктах. Организованности и умения распределить задачи так, чтобы достичь поставленных целей. Вежливости, внимательности, развитого эмоционального... Бронировать локации, готовить оборудование, координировать работу преподавателей, оповещать учеников об изменениях, организовывать онлайн-трансляции, видео- и фотосъемки, кофе-брейки. ",40000.0
Программист,"Прикладная информатика в экономике, прикладная математика в экономике, менеджмент, финансы и кредит. Опыт работы на должностях: Программист. Стаж работы по... Сопровождение информационных систем, используемых в Холдинге. - модификация существующих и разработка новых информационных систем. - разработка механизмов интеграции между информационными системами, используемыми...",88305.0
Программист 1С (начинающий),"Требуемые знания: - Уверенные знание платформы ""1С:Предприятие 8"" (конфигурирование, программирование, механизмы интеграции). - Опыт работы с типовыми конфигурациями приветствуется. Обновление, настройка и сопровождение программных решений на платформе 1С.",60900.0
Программист 1с,"Опыт работы и уверенные знания 1С:Комплексная автоматизация - (или 1С: ERP) – (или 1С: Управление Торговлей).  Развитие и поддержка 1С: КА 2.5 . Доработка системы под задачи организации, участие в разработке частных технических заданий. ",150000.0
Наладчик станков с программным управлением,"Опыт работы на промышленных предприятиях (механообработка). Умение читать чертежи. Умение пользоваться универсальными мерительными инструментами. Ответственность, высокая обучаемость, коммуникабельность.  Умение работать с технологической документацией. Наладка станков с ЧПУ. Корректировка управляющих программ и инструмента. Выявление дефектов во время эксплуатации оборудования. ",80000.0
Стажер-программист 1С,"  Мы ООО УК Деловые люди - организация, в которой обслуживаются компании, представляющие такие бренды как Азбука мебели , Народные кухни , EGO и многие другие. Всего насчитывается около 70 мебельных магазинов и несколько интернет-магазинов на Дальнем Востоке. Приглашаем в свою команду Стажера-программиста 1С. Обязанности: • Сопровождение программных продуктов 1 С; • Консультации пользователей. Требования: • Наличие базовых знаний любого языка программирования; • Желательно образование в области IT; • Желание быстро развиваться, обучаться. Мы предлагаем: • Работу в крупной стабильной компании; • Заработная плата обсуждается индивидуально; • Бесплатное обучение под руководством наставника; • Гибкий график, 5-дневный рабочий день, возможно 4 часа в день, промежуток времени определяется по договоренности; • Бесценный опыт в дружной команде профессионалов. 1C: Предприятие Стремление развиваться 1С программирование Работа с компьютером",30000.0
Программист-разработчик,"Опыт работы в Банках на позиции аналитик, разработчик. Опыт разработки на языках PL/SQL PL+/. Хорошее знание АБС ЦФТ-Банк... Разработка на платформе ЦФТ-Банк, PL/SQL PL+/. Реализация нового функционала,доработка существующего. Локализация и устранение ошибок.",200000.0
Наладчик станков с программным управлением,"Образование среднее профессиональное/высшее (желательно техническое). Опыт работы на станках с ЧПУ (металлообработка) обязателен. Наладка нулевого положения и зажимных приспособлений. Подбор режущего, контрольно-измерительного инструмента и приспособлений. Установка и смена приспособлений и инструмента. ",60000.0
Программист (middle),"Вся команда работает на достижение результата. Обладаете такими личностными качествами, как ответственность обучаемость. Вашим преимуществом будет: умеете читать техническую документацию... Занимаемся созданием интересных проектов по автоматизации производственных процессов и разработкой передовых метрологических приборов. Работали с ""железом"" (Hard) и серверным стеком...",80000.0
Программист AMO CRM,"Опыт в разработке подобных настроек для AMO CRM. Создать приложение, которое будет считать нужное количество заявок на менеджера в зависимости от нескольких переменных. Разработать рабочий стол руководителя отдела...",100000.0
Инженер-программист,"  Установка требуемого программного обеспечения на компьютеры организации Изучение соответствующей технической документации в сфере своей компетенции Тестирование программных решений Проведение отладки программных продуктов Сопровождение программных продуктов в ходе их использования другими сотрудниками Применение технических решений и языков программирования для обработки требуемой информации Контроль за обновлением установленного программного обеспечения Мониторинг ситуации с вирусами и потенциально вредными файлами Установка требуемых параметров (пароли, права доступа и пр.) для работы локальной сети учреждения Мониторинг корректности работы используемых серверов Отслеживание корректности параметров регулярной архивации значимых файлов Анализ ошибок программных продуктов и поиск путей их устранения Определение возможностей для применения новых программных решений Взаимодействие с другими инженерами в ходе трудовых мероприятий Участие в разработке регламентов и других документов по инженерно-программным вопросам Заполнение соответствующей документации Соблюдение правил пожарной и технической безопасности, а также стандартов трудовой дисциплины Консультирование руководителей и коллег по инженерно-программным вопросам имеющее среднее профессиональное образование - программы подготовки квалифицированных рабочих (служащих) (рекомендуется дополнительное профессиональное образование - программы повышения квалификации по профилю деятельности); имеющее опыт работы не менее шести месяцев в области разработки компьютерного программного обеспечения. пятидневный режим работы ",50000.0
Ведущий программист-математик,"Высшее образование в АйТи и математике. Опыт разработки программ от 3 лет. Опыт программирования математических задач. Опыт разработки мобильных приложений... Программирование математических задач для мобильных приложений под Андроид для спутниковой навигации и геодезии, по agile методологии. Исправление дефектов. ",217500.0
Инженер-программист,Высшее образование. Уверенное знание языка С. Знание языка С++. Наличие собственных проектов разработки ПО (Просьба в резюме указывать ссылку на... Тестирование ПО. Верификация ПО.,49000.0
"Программист (Web, php, Python)","Знание Php или Python, работа с базами данных (MySQL, MongoDB). Опыт разработки web-приложений. Приветствуется опыт разработки сайтов, баз данных... Разработка Web-приложений и микросервисов. Тестирование и отладка ПО.",65000.0
Программист 1С,Опыт разработки на платформе 1С 8.х от года. Свободное владение языком запросов 1С. Работа с расширениями конфигурации.  Программировать на 1С. Настройка функционала ЭДО ( электронных транспортных накладных) в 1С/SAP. Разрабатывать расширения конфигураций для 1С...,123540.0
Программист-аналитик,"Знание 1С Бухгалтерия, ERP. Участие в разработке технических заданий и методологии. Описание бизнес-процессов и реализация их в конфигурации. Аналитика архитектуры конфигурации БД и...",190000.0
Программист 1C 8,Опыт программирования на платформе 1С 8.х от 2х лет в режиме управляемого приложения. Базовые знания бизнес-процессов... Участие в проектах разработки на платформе 1С 8.х.,147500.0
Программист 1С,"Профессиональное IT-образование. Знание платформы 1С и опыт программирования в конфигурации 1С 8, 8.3 (от 1 года).  Доработка, развитие и поддержка информационной структуры торгово-производственного предприятия на базе 1С 8.3 (конфигурация «УНФ»). Разработка решений на...",150000.0
Программист-разработчик,Высшее образование. Исполнительность. Умение работать в коллективе. Стремление к профессиональному росту. Программирование цифровых информационных систем. Разработка хранилищ гидрометеорологических данных.,34800.0
Программист C++/Qt,"Обязательные навыки: Уверенные знания C++, опыт работы на С++ не менее 3-х лет. Опыт программирования в среде Qt.  Предстоящие задачи: - Разработка ПО для управления комплексами и изделиями, выпускаемыми предприятием. - Разработка ПО интерфейсов пользователя. В соответствии с Постановлением Правительства...",120000.0
Ведущий программист 1С,"Практический опыт разработки на 1С 8.х от 3 лет и выше. Знание и опыт в написании запросов, использование... Разрабатывать на платформе ""1С:БО"" по стандартам 1С. Получать задачи в виде ТЗ или в устной форме от...",130500.0
Ведущий программист Python,Владение Python на высоком уровне. Знание ООП. Знание паттернов проектирования и умение их применять. Опыт работы с базами данных.  Разрабатывать распределенные высоконагруженные информационные системы. Разрабатывать объекты бизнес-логики и эффективные методы для доступа к данным. Оптимизировать скорость обращения к...,195750.0
