title,description,real_salary
Младший программист 1С,"Будет круто, если у тебя есть Сертификаты 1С:Профессионал, но и без них мы тебе рады). Опыт работы программистом... Разработка по ТЗ несложных задач под присмотром наставника: Печатные формы. Отчеты и обработки. Несложные доработки типового функционала. Усиленное повышение профессиональных...",40000.0
Программист-разработчик 1С,Опыт разработки на платформе 1С Предприятие 8.3 не менее года. Умение читать чужой код. Хорошие знания методик разработки... Выработка путей решения задач вместе с командой. Разработка по сформированному плану задач. Ручные тесты и передача в контур доставки релиза. ,170000.0
Инженер-программист,"Опыт работы обязателен. Написание Т3.Обучение пользователей.консультирование пользователей. Написание инструкций по работе в программе. Сопровождение ЕRP 2.4, ЗУП 3,1.",70000.0
Программист 1С,"Высшее профильное образование в области информационных технологий или в смежных областях: математика, физика, инжиниринг. Желание учиться новому, совершенствоваться, проявлять творческую... Помощь и поддержка пользователей корпоративной системы 1С8 Бухгалтерия. Идентификация моментов для оптимизации с последующим внедрением решения. ",110000.0
Преподаватель Программирования/Робототехники (Информатики),"Любите и умеете общаться с детьми разных возрастов. Интересуетесь компьютерными технологиями и сферой IT; конструированием и всегда с удовольствием читаете... Подготавливать класс и проводить занятия с детьми начальной и средней школы (1-7 класс), по нашей методической программе. ",36975.0
Программист-стажер 1С,Высшее техническое образование. БАЗОВЫЕ ЗНАНИЯ ОСНОВ РАЗРАБОТКИ В СРЕДЕ 1С. Опыт разработки на других языках приветствуется. ТопФактор – это дружная творческая команда разработчиков тиражных программных продуктов для HR-автоматизации. Уже более 20 лет создаем автоматизированные решения на...,41325.0
Инженер-технолог/программист станков ЧПУ,Высшее техническое образование (желательно профильное) Опыт в разработке и внедрении управляющих программ для станков с ЧПУ от 3-х лет... Оценка возможности производства деталей на имеющемся оборудовании. В распоряжении станки лазерной резки и гибки; Разработка технологичных стратегии производства детали на...,100000.0
программист,"   КГБУЗ «Камчатской краевой детской больнице» на постоянную работу Выполняет работу по подготовке программ к отладке и проводит отладку. Разрабатывает инструкции по работе с программами, оформляет необходимую техническую документацию. Определяет возможность использования готовых программных средств. Осуществляет сопровождение внедренных программ и программных средств. ",43500.0
Ведущий программист 1С,"Опыт разработки в среде 1С от 3-х лет. Опыт работы с нетиповыми конфигурациями 1С. Опыт работы с... Сопровождение и развитие программных модулей на базе 1С (КА, Бухгалтерия, Документооборот, ЗУП и другие). Организация экспорта и импорта данных...",261000.0
Артистка / Артист шоу программы в ночной клуб,"Дружелюбие, обучаемость, презентабельный внешний вид. Опыт работы, не важен, в клубе есть хореограф, который всему научит. Общительность, умение работать в... Исполнение танцевальных номеров. Участие в тематических вечеринках и шоу программах клуба. Взаимодействие с менеджерами. Совершенствовать приобретенные навыки с хореографом клуба.",147900.0
Программист Битрикс 24,Опыт работы в аналогичной сфере от 3-х лет. Образование высшее техническое. Знание архитектуры Битрикс 24 и API Битрикс24.  Разработка кода программного продукта на уровне модулей и компонентов под требования заказчика. Анализ и оптимизация кода с использованием инструментальных средств...,83955.0
Программист 1с,"   Автоматизация деятельности компании-работодателя на базе 1С «Предприятие». Настройка и администрирование стандартных и нетиповых конфигураций на базе 1С. Разработка конфигураций под задачи заказчика. Составление инструкций и технической документации к создаваемому программному продукту. Поддержка и консультация пользователей. Профильное образование опыт программирования в среде 1С Предприятие 8 (возможно начинающий специалист) 5/2, 8:30-17:30 Полный соц.пакет Оплата больничных листов Бесплатное питание Своевременная выплата заработной платы 2 раза в месяц Выплата премий, при успешном выполнении должностных обязанностей Удобный график работы Возможности карьерного роста Корпоративное обучение, тренинги Корпоративные мероприятия Скидка 50% на посещение фитнес-зала «Ольхон». для вас и ваших близких. Отдых на корпоративной туристической базе в п. Максимиха Выплата стипендии детям сотрудников компании Подарки для детей сотрудников (к 1 сентября (первоклашки), к Новому году) 1С: Предприятие 8 1С программирование 1С: Документооборот Техническая поддержка Управление персоналом 1С: Предприятие MS Visual Basic Организаторские навыки",100000.0
Программист-разработчик (Full-stack JavaScript разработчик),"КАНДИДАТУ НЕОБХОДИМО ОБЛАДАТЬ ВСЕМИ НАВЫКАМИ, ПЕРЕЧИСЛЕННЫМИ НИЖЕ: Понимание принципов работы SPA, Rest API. Опыт frontend разработки с использованием TypeScript, Angular... Программирование, Full-stack JavaScript разработка. Организация более 10 лет на рынке.",150000.0
PHP-программист,"Адекватное отношение к чужому коду и к конструктивной критике своего. Коммуникабельного и активного человека, с которым было бы легко и... Работа с API сервисов: AmoCRM, Google Docs и многие другие, в зависимости от задачи клиента. Написание скриптов интеграций различных сервисов...",100000.0
Преподаватель программирования и математики,"Ответственных. Пунктуальных. Готовым уделять работе время, а детям - внимание. Целеустремленных. Готовых развиваться в сфере образования. Предпочтение отдается кандидатам с опытом... Преподаватель математики и программирования в IT-школу “SHIFT” для детей с 1 по 7 класс.",44370.0
Ведущий инженер-программист / Главный специалист,Высшее профильное образование по IT-специализации. Знание платформы и конфигурации 1С:УПП 1.3. Опыт автоматизации учета и программирования... Программирование 1С. Доработка и и внедрение типовых программ 1С. Написание обработок и отчетов.,39150.0
Программист встраиваемых систем,"Опыт работы с контроллерами на базе архитектуры ARM. Уверенное владение языками C/C++. Опыт разработки многопоточного ПО. Владение средствами сборки... Разработка устройств на базе Cortex, ARM7, ARM9, DSP C55xx, C66x с применением Embedded - Linux...",165000.0
Программист 1С (ученик),"Обязательно владение навыками программирования на любом языке (понимание циклов, процедур, условий). Опыт в области 1С необязателен. Желательно образование в... программирование на языке 1С. - консультации пользователей. - участие в проектных работах.",90000.0
Инженер-программист,Высшее техническое образование. Готовность к изучению нового. Установка и настройка СБИС на рабочем месте клиента и в офисе. Обучение пользователей работе в системе. Техническая поддержка клиентов.,36540.0
программист 1с,"   Техническая поддержка пользователей по 1С; Доработка печатных форм, обработок и отчетов; Работа с ТСД. Высшее образование; Базовое знание любого языка программирования; Опыт разработки на любом языке программирования; Знание программ 1С:УПП, 1С:БП 3.0. Достойная и стабильная заработная два раза в месяц, 62 000 руб. на руки; Горячие обеды; Карьерный рост; Софинансирование обучения, повышения квалификации; Помощь наставника в период адаптации на рабочем месте; Подарки детям сотрудников (1 сентября, Новый Год); Социальный пакет (отпуск, больн. лист); Рабочий день с 9 до 18 часов, 5/2; Корпоративные скидки: фитнес, бассейн, солярий, тренажерный зал, детские игровые центры, парк виртуальной реальности; Программа Пригласи в Компанию специалиста- получи премию! ; Программа Лучший сотрудник месяца ; Дружный коллектив, уважение и поддержка руководства; Корпоративные мероприятия. 1С программирование",62000.0
Программист 1С,"Знание типового функционала торговых конфигураций УТ (УНФ, КА, ERP). Знание типового функционала конфигурации 1С:Бухгалтерия предприятия 3.0.  Разработка в 1С:УТ 11.4, 1С:БП 3.0, 1С:КА 1.1 (участие в переходе...",174000.0
Инженер-программист,"Знание C обязательно. Assembler (любой), опыт работы с binutils. Опыт использования Linux, bash, python. Базовые знания сетевых технологий.  Реверс-инжиниринг. Исследование логики работы устройств на базе unix различных архитектур. Доработка функционала устройств (как при наличии исходных кодов, так...",180000.0
Программист,"  Разрабатывает на основе анализа математических моделей и алгоритмов решения экономических и других задач программы, обеспечивающие возможность выполнения алгоритма и соответственно поставленной задачи средствами вычислительной техники, проводит их тестирование и отладку. Разрабатывает технологию решения задачи по всем типам обработки информации. Осуществляет выбор языка программирования для описания алгоритмов и структур данных. Определяет информацию, подлежащую обработке средствами вычислительной техники, ее объемы, структуру, макеты и схемы ввода, обработки, хранения и вывода, методы ее контроля. Выполняет работу по подготовке к отладке и проводит отладку. Определяет объем и содержание данных контрольных примеров, обеспечивающих наиболее полную проверку соответствия программ их функциональному назначению. Осуществляет запуск отлаженных программ. Проводит корректировку разработанной программы на основе анализа выходных данных. Определяет возможность использования готовых программных продуктов. Разрабатывает инструкции по работе с программами, оформляет необходимую техническую документацию. Осуществляет сопровождение внедренных программ и программных средств. Выполняет работу по унификации и типизации вычислительных процессов. Обеспечивает правильную техническую эксплуатацию, бесперебойную работу компьютеров и отдельных устройств. Принимает участие в проведении инвентаризаций. Программист в своей деятельности подчиняется непосредственно главному врачу. В своей работе руководствуется официальными документами по выполняемому разделу работы, приказами и распоряжениями вышестоящих должностных лиц. ",35000.0
Программист C#,"Знание языка C# и средств разработки VisualStudio, git, SQL. Высшее техническое образование. Разработка приложения с использованием WinForms для сбора, анализа, обработки и визуализации информации от приборов для исследования нефтяных и газовых скважин.",220000.0
Программист-разработчик 1С (удаленно),"1. Обязательны: 2) опыт внедрения 1С в качестве <highlighttext>программиста</highlighttext> от 1 года. 3) высокие компетенции в программировании 1С.  1) глубокое знание одного или нескольких блоков – Бухгалтерия, Кадры, Производство, Склады, Розничные продажи, Онлайн продажи, Оптовые продажи, Закупки, Казначейство, Бюджетирование...",165000.0
Инженер-программист (Умный Дом),"Уверенное владение языком JavaScript, приветствуется C/C++. Способность читать и понимать принципиальные электрические схемы. Есть представление о принципах работы протоколов... Проведение пуско-наладочных работ на объекте, либо удаленно. Изучение новых технологий, интеграция с существующими решениями. Разработка новых решений в сфере...",120000.0
Преподаватель робототехники и программирования для дошкольников и младших школьников,"Оконченное высшее профильное образование (можно в т.ч.студенты). Аналогичный опыт работы с детьми дошкольного и школьного возраста, умение разговаривать с ними... Разработка и внедрение учебного плана для каждой возрастной категории (из расчета 1 занятие в неделю). Проведение развивающих занятий для детей...",22500.0
программист,"   Развитие и сопровождение кредитного конвейера Банка (Динамика, ЦФТ-Банк). Реализация API для взаимодействия АБС Банка с внешними системами и внешних систем с АБС (REST API -&gt; JSON, XML, SOAP -&gt; XML) Доработка бизнес-процессов кредитного конвейера в BPMN-нотации на движке Camunda. Таск-трекер Redmine (он идеально подходит для нашего способа работы по Agile) CMS Bitrix для создания монолитных Web-приложений и сопутствующий стек технологий (vue.js, php, bitrix framework) Для создания клиентских микросервисов используется стек golang + reacjs + docker и все это работает через REST API Также мы активно работаем с БД Oracle и пишем всесторонние интеграции, в том числе на языке PL/SQL (также активно готовимся к переходу на PostgreSQL) В качестве системы контроля версий у нас развернут Gitlab В нашем парке встречаются как операционные системы Linux (в основном rpm-based), так и Windows (Windows Server) Знание SQL (PL/SQL, PL/Plus). Понимание реляционных баз данных и опыт проектирования моделей данных (преимуществом будет знание Oracle или PostgreSQL). Умение читать схемы в BPMN-нотации. Понимание работы сетевых протоколов (в частности HTTP) и REST API. Умение читать и разбираться в чужом коде. Высокий уровень ежемесячного дохода; Уникальную атмосферу для продуктивной работы и развивающую среду, где можно найти единомышленников и научиться новому; Команду экспертов, возможность самореализации, сложные и интересные задачи для тех, кто любит настоящие вызовы в работе; Официальное трудоустройство согласно ТК РФ; Возможность карьерного роста и развития внутри банка; Внутреннее и внешнее обучение сотрудников; Бесплатное использование корпоративной библиотеки; Компенсацию расходов на абонемент в спортзал; Льготное кредитование для сотрудников; Реферальную программу «Приведи друга»; Материальную помощь и социальную поддержку; Богатую корпоративную жизнь (Конкурсы, спортивные и выездные мероприятия); Быструю адаптацию с личным наставником; График работы: 5/2 с 08:30 до 17:30 SQL Gitlab PL/SQL Oracle CRM HTTP",60000.0
Tilda Оптимизатор сайтов / Web-программист,"Опыт работы на Tilda, WPress, Bitrix будет основным преимуществом. Знание программирования, РСС. Опыт продвижения в студии (будет вашим преимуществом).  Продвижение сайтов в ТОП Яндекс‚ Google. Составление стратегии и планов работ по продвижению. Ведение аналитики и сбор статистики. ",70000.0
Ведущий программист 1С, ,113100.0
Ведущий инженер-программист,"Знание ОС Windows, Microsoft Office (Word, Excel, PowerPoint), Windows-server, Linux. Опыт программирование С#, Java. Опыт работы с БД Oracle... Администрирование САПР (систем автоматизированного проектирования). Аналитика взаимодействия САПР систем (Teamcenter, Лоцман PLM). Разработка интеграционных модулей между системами. Доработка функционала систем...",43500.0
Программист .NET,"Высшее образование. Опыт разработки приложений на ASP.NET MVC, HTML, CSS, JavaScript, jQuery, Entity Framework, базы данных MS SQL Server.  Full-stack разработка и поддержка ASP.NET MVC приложений, веб-сервисов и других продуктов. Использование GitLab в качестве системы контроля версий...",69600.0
