title,description,real_salary
JS-программист,"Опыт разработки на JavaScript, TypeScript, знания HTML, CSS. Уверенных навыков работы с системами контроля версий. Хороших знаний паттернов проектирования и... ",165300.0
Fullstack web-программист,"Node.js MySQL SQL PHP 7 CSS3 HTML5 Redis Linux  Если вы увлечены своей профессией, любите разрабатывать современные веб-приложения и гордиться результатом своей работы – то мы с удовольствием доверим вам свои идеи! Нам нужен сильный специалист на fullstack разработку, способный решать сложные и интересные архитектурные задачи по разработке интернет-проектов и интеграции со сторонними сервисами. О проектах: Мы работаем над предоставлением нашим клиентам целого комплекса IT-решений, начиная с e-commerce и заканчивая digital-трансформацией традиционной розницы. Также реализуем проекты автоматизации каталогов и систем подбора автотоваров для наших партнёров. Наши решения основаны как на собственных разработках и базах данных, так и на интеграциях со сторонними поставщиками. Кто создает продукты: Сейчас в нашей команде разработки более 15 сотрудников, большая часть из которых — backend и frontend-разработчики уровня Middle и Senior, многие из которых могут выполнять fullstack задачи. В проектные команды также включаются проектные менеджеры и инженеры по тестированию. Как создаются продукты: Пишем на PHP7+ и Node.JS на бэке, ES6/TypeScript на фронте. В работе применяем смесь agile-практик: scrum, kanban, TDD, ежедневные митинги, code review. По задачам работаем в Trello (тут у нас построен свой процесс), документацию ведем в Confluence, код храним на Gitlab, работаем по git flow. Все проекты построены на базе Docker-контейнеров, вся инфраструктура в облаке. Каждую ветку собираем на отдельном тестовом стенде через Jenkins, тестируем в полноценном окружении взаимосвязанных сервисов, после чего деплоим по кнопке в production (бывает, релизим по несколько раз в день). Проекты мониторим в ELK+Grafana, логи приложений храним в ELK+Sentry. Кто нам нужен: Мы в поиске Senior разработчиков на backend и frontend. Профи, одинаково хорошо умеющих и то, и другое приветствуются особо. Ожидаем не менее 3 лет опыта реальной разработки, уверенные знания в стеке и широкий кругозор в целом. Что мы можем вам гарантировать: Активное участие в развитии продуктов; Интересные и нестандартные задачи; Поощрение инициатив и интересных идей; Комфортабельный и очень современный офис, уютные места отдыха, хорошее питание на территории компании и бесплатный кофе; Отличный дружный коллектив, технически грамотное руководство и по-человечески теплое окружение; Удобное рабочее место и хороший компьютер; Бесплатную парковку и свое парковочное место; Достойную оплату труда; Работу в крупной стабильной компании; Официальное трудоустройство с первого рабочего дня. Чем предстоит заниматься: Разработка и развитие сайтов, веб-приложений и облачных сервисов; Проектирование архитектуры проектов; Интеграция со сторонними системами и сервисами; Рефакторинг и оптимизация приложений; Код-ревью; Написание unit-тестов. Требования : Умение разбираться в поставленных задачах, уточнять их условия и результат, выбирать эффективные способы решения; Понимание ООП и паттернов проектирования, следование принципам SOLID и DRY; Понимание стратегии оптимизации веб-приложений; Уверенное владение PHP7; Отличное знание HTML5, CSS3, JavaScript; Опыт разработки кросс-браузерных веб-приложений с асинхронным client/server взаимодействием (JSON, AJAX, WebSocket); Понимание принципов RESTful API; Опыт проектирования реляционных баз данных (MySQL, PostgreSQL), хорошее знание SQL и умение оптимизировать SQL-запросы (индексы, explain); Хорошее знание какого-либо популярного фреймворка (Laravel, Zend, Symfony, Yii); Опыт работы с Redis, RabbitMQ, memcached; Уверенная работа в консоли Linux; Понимание процессов CI/CD, опыт работы с инструментами из этой сферы (Jenkins, GitLab CI и т.д.); Будет плюсом опыт DevOps, работы с Docker, Node.JS, MongoDB. Условия работы: Комфортный график работы: график работы обсуждается; Итоговая заработная плата обсуждается на собеседовании (зависит от уровня знаний и компетенций кандидата). Гиперавто — это омниканальный ритейлер-инноватор на рынке автомобильных товаров и услуг. Мы сочетаем современную интернет-площадку, передовые розничные магазины и квалифицированное техническое обслуживание, предлагая автомобилистам удобный сервис онлайн и оффлайн. Сайт hyperauto.ru — это продвинутый инструмент для поиска полезной информации об автомобилях, подбора аксессуаров и запчастей, их заказа и доставки в любую точку России: от Балтийска и до Анадыря. Ежемесячно сайт посещают более 500 000 уникальных пользователей. И с каждым месяцем эта цифра растёт на 10%. ",165000.0
Системный программист Linux,"   Системные вызовы Linux; Стандарт POSIX, библиотека libc, механизмы взаимодействия параллельных процессов, многопоточное программирование (multi-thread); Make (хорошие знания Makefile-ов), gdb, svn/git. Знание Си, Си++, bash, perl/lua, sed/awk/grep; Хороший технический английский (чтение). Желательно знакомство с криптоалгоритмами ГОСТ, знание PKI (сертификаты, CRL, PKCS10, CMS), Знание ASN.1. Знание OpenSSL (хотя бы на уровне API). Хороший опыт работы в Linux/Unix системах, знание основных утилит командной строки, средств отладки; Знание TCP/IP сетей и модели OSI; Опыт написания переносимого и безопасного кода; Опыт программирования и отладки в режиме ядра (kernel mode); Навыки использования: valgrind, gdb, objdump, strace, tcpdump; Умение разобраться в чужом коде; Опыт написания сетевых демонов; Умение анализировать kernel panic; Знание ассемблера x86-64; Понимание архитектуры современных ОС. Личные качества: аккуратность, адекватность, логика, мотивация, трудолюбие, способность обучаться и глубоко разбираться в проблемах. Желание/умение работать в команде; Английский язык (технический) Зарплата обсуждается в зависимости от опыта работы, уровня квалификации и соответствия требованиям вакансии; Возможность профессионального и карьерного роста; Оформление по ТК РФ (трудовой договор, трудовая книжка); Расположение офиса: между м. ул. 1905 г. и м. Беговая (с 8-00 до 20-30 автобус компании по расписанию возит сотрудников к / от метро). ",261000.0
Инструктор групповых программ/тренер универсал,"Опыт работы от 6 месяцев и выше. Образовательные сертификаты. Приветствуется физкультурное образование. Знания в области физиологии, биомеханики движения. Харизматичность, яркость.  Проведение групповых тренировок, коммерческих классов: мини-группы, персональные тренировки. Вводные тренировки. Выполнение плана. Участие в мероприятиях клуба. Ведение отчетной документации.",104400.0
Инженер группы мониторинга и технической поддержки программного обеспечения,"...данных. Знание основ информационной безопасности. Практические навыки обработки информации с помощью технических и программных средств. Наличие опыта работы системным администратором.  Установка, настройка и администрирование программного обеспечения и операционных систем. Настройка интеграции программного обеспечения с внешними сервисами. Мониторинг работоспособности программного обеспечения. ",80000.0
Программист 1С (Senior),"   О б я з а н н о с т и : В с в я з и с р а с ш и р е н и е м о т д е л а и щ е м к с е б е в к о м а н д у п р о г р а м м и с т а 1 С у р о в н я S e n i o r - Р а з р а б о т к а п о д п л а т ф о р м у 1 С : П р е д п р и я т и е 8 . 3 - Д о р а б о т к а к о н ф и г у р а ц и й в н у т р е н н е й р а з р а б о т к и - Д о р а б о т к а т и п о в ы х к о н ф и г у р а ц и й : Б П 3 . 0 , З у П 3 . 1 - Р а з р а б о т к а п о д м о б и л ь н у ю п л а т ф о р м у - Н а п и с а н и е и н т е р е с н ы х а н а л и т и ч е с к и х о т ч е т о в - И н т е г р а ц и я с о с т о р о н н и м и с е р в и с а м и и п р и л о ж е н и я м и ( S O U P , J S O N R P C ) - О б м е н м е ж д у р а з л и ч н ы м и к о н ф и г у р а ц и я м и п л а т ф о р м ы 1 С Т р е б о в а н и я : н а ц е л е н н о с т ь н а р е ш е н и е з а д а ч , а н а л и т и ч е с к о е м ы ш л е н и е , с и с т е м н о с т ь , о т в е т с т в е н н о с т ь , п у н к т у а л ь н о с т ь , п о з и т и в н ы й н а с т р о й . У с л о в и я : М ы п р е д л а г а е м : - И н т е р е с н ы е з а д а ч и - У ю т н ы й о ф и с - Д о с т о й н у ю з а р а б о т н у ю п л а т у б е з з а д е р ж е к ( 2 р а з а в м е с я ц ) - К о р п о р а т и в н у ю с к и д к у н а т о в а р ы З е л е н ы й О с т р о в и Т е х н о д р о м 2 0 % - Д р у ж н ы й м о л о д о й к о л л е к т и в Ж д е м в а ш и р е з ю м е н а у к а з а н н у ю п о ч т у . 1С программирование 1С: Розница",150000.0
Программист С++,"Знание C++ . Знание и понимание ООП. Английский язык на уровне чтения технической документации (intermediate). Умение работать в команде, умение работать... Разрабатывать расширение для ArcGIS Pro на C++, писать автоматические тесты.",100000.0
Инженер-программист,"Знание основ объектно-ориентированного программирования. Знание языков программирования (T-SQL, C#, Delphi). Знание СУБД (MS SQL, Oracle и др.), COM... Разработка программных модулей для реализации проектных решений на базе ПО АСКОН. Выполнение технических работ по установке и настройке ПО АСКОН...",100050.0
Программист-разработчик,"Базовые знания SQL, JavaScript, C#. Опыт работы в Visual Studio. Понимание принципов работы систем управления версиями. Быстрая обучаемость.  Разработка нового функционала на бэкенде\фронтенде, написание тестов на свой код. Работа над кодом в составе команды. Работа с базами...",130500.0
Программист 1С,Релевантный опыт работы от 1-го года. Навыки обновления типовых и не типовых конфигураций. Будет являться преимуществом знание основ производственного... Разработка нового функционала и поддержка уже созданного в 1С системах. Доработка конфигураций 1С по обращениям пользователей. ,70000.0
Программист,"Net Core/.NET 5. EF Core. MSSQL. JavaScript, HTML, CSS. C#. Высшее образование. Опыт работы от 1 года.  Организация работает в сфере производства электронных компонентов аппаратуры.",65943.39
Программист 1C,"Опыт работы с продуктами Git, RabbitMQ, Atlassian Jira, Confluence, SonarQube, ElasticSearch. Адекватная реакция на критику, умение докапываться до сути вопроса.  Участие в разработке и внедрении как нетиповых конфигураций, так и доработке типовых решений на платформе 1С: Предприятие 8.3. ",120000.0
Программист-тестировщик (отдел автотестирования),"Начальные знания одного из языков программирования (базовые типы и умение работать с ними, циклы, функции). Желание развиваться в области автотестирования.  ",60030.0
Программист pgSQL,"Отличное знание SQL. Отличное знание языка PL/pgSQL. Навыки проектирования баз данных, индексов. Готовность работать в команде. ...в системе управления исходным кодом. Тестирование, документирование разрабатываемых функций. Взаимодействие с постановщиками задач. Командная работа с разработчиками backend и frontend.",130500.0
Junior+/Middle PHP-программист / PHP-developer (Backend),"Уверенные знания языков PHP, SQL.  Базовые знания языков HTML, CSS, JavaScript.  Уверенное знание PHP-фреймворка Laravel или Yii 2 или... Удаленная вакансия PHP-программиста/разработчика уровня Junior+/Middle на задачи по Backend (бэкенд) в крупную IT-компанию по предоставлению услуг...",100000.0
Backend-разработчик/Программист,"Знание PHP, MySQL,Git. Будет преимуществом, если есть навыки обеспечения комплексной безопасности веб-сервера. Оптимизировать / профилировать / рефакторить существующий код сайта и модулей к нему. Разбираться в проблемных зонах оптимизации сайта, а также грамотно распределять...",140000.0
Программист PHP/MySQL/JS/Bootstrap,"Базовые знания и желание улучшать знания по (в порядке приоритета): PHP, HTML, CSS, Git, JS, SQL. Наличие у вас современного... Рефакторинг и улучшение/добавление новых функций в коде платформы для продажи автомобилей, PHP (без фрейморка), MySQL, Bootstrap 4, JS/jQuery. ",50000.0
Программист Java (embedded-системы),"Java, Spring Boot, JPA, Hibernate, liquibase, jetty, TestNG, mockito. PostgresSQL, Clickhouse. REST, Websocket, AMQP. Git, Gitlab, YouTrack, wiki.  Проектирование и реализация backend-сервисов на Java. Участие в разработке архитектуры. Code review, анализ и оптимизация кода. Поддержка существующих систем...",300000.0
Программист 1С,"Знание одной из типовых конфигураций (БГУ, БП, ЗУП, УПП, УТ, УНФ, УХ) на уровне программиста. Весомое преимущество - знание одного из... Разработка новых решений, тестирование доработок. Участие в проектах по разработке и внедрению новых систем автоматизации определенных видов деятельности (сейчас основное...",100000.0
"Помощник веб-программиста (стажер, удаленная работа)","Профильное техническое образование. - Желание расти и профессионально развиваться. - Начальные знания программирования. Верстка HTML + CSS. - Разработка на PHP, JavaScript. - Работа с CMS. - Поддержка существующих проектов.",18000.0
Web-программист,"Опыт работы от 2 лет. Уверенное знание PHP 7.2, MySqL, Laravel. Умение писать простой и понятный код, который легко... Обеспечение доставки в согласованный срок согласованной функциональности. Поддержка существующего сайта на Битрикс, в дальнейшем переход на Laravel + VueJS. ",100000.0
Программист,"Стаж работы не менее 3-х лет. Обеспечение бесперебойной работы локальных сетей [организации, предприятия, учреждения], серверов, сетевых устройств. Инсталляция и настройка системного программного обеспечения. Осуществление конфигурации программного...",80000.0
"Программист-разработчик 1C, удалённо","РЕЛЕВАНТНЫЙ ОПЫТ РАБОТЫ ОТ 5 мес.! БУХГАЛТЕРАМ НЕ ПОДХОДИТ! Опыт пользования типовыми конфигурациями 1С: УТП, УНФ, Склад, Розница.  20 направлений, образующих автоматизированную работу предприятий. Проектирование и реализация нового функционала в 1С. Работа с конфигурациями 1С: Розница...",105000.0
программист 1с,"   Обновление типовых/не типовых конфигураций на базе 1С: Предприятия 8 Настройка и администрирование стандартных и нетиповых конфигураций на базе 1С. Разработка конфигураций под задачи заказчика, доработка печатных форм документов. Составление инструкций и технической документации к создаваемому программному продукту. Поддержка и консультация пользователей. Профильное образование Опыт программирования в среде 1С Предприятие 8 (возможно начинающий специалист) Знание типовых конфигураций 1С, наличие сертификатов 1С приветствуется Знание основ бухгалтерского учета и зарплатного учета приветствуется Личные качества: ответственность, исполнительность, аккуратность, педантичность, оперативность, стрессоустойчивость, умение работать в команде. официальное трудоустройство, социальный пакет своевременная выплата заработной платы График работы 5/2 с 7:45-17:15 рабочее место только на территории завода, работа удаленно не допустима ",60000.0
Программист Python,"Опыт разработки на языке Python. Опыт работы с Oracle или PostgreSQL, знание SQL. Приветствуется: опыт интеграции приложений. Разработка приложения для нефтегазовой отрасли. Сопровождение приложений для нефтегазовой отрасли. Интеграция приложений для нефтегазовой отрасли.",125000.0
